<?xml version="1.0" encoding="UTF-8"?>
<!DOCTYPE custos [
    <!ENTITY dollar "&#36;">
    <!ENTITY euro "&#x20AC;">
]>
<custos xmlns="https://tcm24twg04.netlify.app" xmlns:xsi="http://www.w3.org/2001/XMLSchema-instance" xsi:schemaLocation="https://tcm24twg04.netlify.app custos.xsd">
    <local nome="Boston">
        <currency>&dollar;</currency>
        <custo>
            <item>Transporte: Ida e Volta</item>
            <valor>800</valor>
        </custo>
        <custo>
            <item>Alojamento(s)</item>
            <valor>760</valor>
        </custo>
        <custo>
            <item>Alimentação</item>
            <valor>400</valor>
        </custo>
        <custo>
            <item>Deslocação</item>
            <valor>150</valor>
        </custo>
        <custo>
            <item>Atividades</item>
            <valor>90</valor>
        </custo>
        <custo>
            <item>Extras</item>
            <valor>80</valor>
        </custo>
    </local>
    <local nome="Monaco">
        <currency>&euro;</currency>
        <custo>
            <item>Transporte: Ida e Volta</item>
            <valor>572</valor>
        </custo>
        <custo>
            <item>Alojamento(s)</item>
            <valor>877</valor>
        </custo>
        <custo>
            <item>Alimentação</item>
            <valor>350</valor>
        </custo>
        <custo>
            <item>Deslocação</item>
            <valor>200</valor>
        </custo>
        <custo>
            <item>Atividades</item>
            <valor>150</valor>
        </custo>
        <custo>
            <item>Extras</item>
            <valor>175</valor>
        </custo>
    </local>
</custos>